{
  "description": "Relative imports, classes, methods, decorators, dynamic calls (heuristic), a Python 2 file",
  "nodes": [
    {"uid": "ext:python:builtins.getattr", "kind": "external", "subtype": "python", "file": null, "line_start": null, "line_end": null},
    {"uid": "ext:python:functools", "kind": "external", "subtype": "python", "file": null, "line_start": null, "line_end": null},
    {"uid": "ext:python:functools.wraps", "kind": "external", "subtype": "python", "file": null, "line_start": null, "line_end": null},
    {"uid": "ext:python:os.path", "kind": "external", "subtype": "python", "file": null, "line_start": null, "line_end": null},
    {"uid": "ext:python:os.path.join", "kind": "external", "subtype": "python", "file": null, "line_start": null, "line_end": null},
    {"uid": "py:legacy.old", "kind": "module", "subtype": "py_module", "file": "legacy/old.py", "line_start": 1, "line_end": 7},
    {"uid": "py:legacy.old.helper_old", "kind": "routine", "subtype": "py_function", "file": "legacy/old.py", "line_start": 6, "line_end": 7},
    {"uid": "py:legacy.old.old_main", "kind": "routine", "subtype": "py_function", "file": "legacy/old.py", "line_start": 1, "line_end": 3},
    {"uid": "py:pkg", "kind": "module", "subtype": "py_module", "file": "pkg/__init__.py", "line_start": 1, "line_end": 1},
    {"uid": "py:pkg.app", "kind": "module", "subtype": "py_module", "file": "pkg/app.py", "line_start": 1, "line_end": 16},
    {"uid": "py:pkg.app.main", "kind": "routine", "subtype": "py_function", "file": "pkg/app.py", "line_start": 6, "line_end": 12},
    {"uid": "py:pkg.core", "kind": "module", "subtype": "py_module", "file": "pkg/core.py", "line_start": 1, "line_end": 28},
    {"uid": "py:pkg.core.Base", "kind": "type", "subtype": "py_class", "file": "pkg/core.py", "line_start": 12, "line_end": 17},
    {"uid": "py:pkg.core.Base.check", "kind": "routine", "subtype": "py_method", "file": "pkg/core.py", "line_start": 16, "line_end": 17},
    {"uid": "py:pkg.core.Base.setup", "kind": "routine", "subtype": "py_method", "file": "pkg/core.py", "line_start": 13, "line_end": 14},
    {"uid": "py:pkg.core.Solver", "kind": "type", "subtype": "py_class", "file": "pkg/core.py", "line_start": 20, "line_end": 24},
    {"uid": "py:pkg.core.Solver.run", "kind": "routine", "subtype": "py_method", "file": "pkg/core.py", "line_start": 22, "line_end": 24},
    {"uid": "py:pkg.core.compute", "kind": "routine", "subtype": "py_function", "file": "pkg/core.py", "line_start": 27, "line_end": 28},
    {"uid": "py:pkg.core.tracer", "kind": "routine", "subtype": "py_function", "file": "pkg/core.py", "line_start": 5, "line_end": 9},
    {"uid": "py:pkg.core.tracer.wrapper", "kind": "routine", "subtype": "py_function", "file": "pkg/core.py", "line_start": 7, "line_end": 8}
  ],
  "call_sites": [
    {"src": "py:legacy.old.old_main", "file": "legacy/old.py", "line": 3, "col": 5, "ref_kind": "call", "target_text": "helper_old", "dst": "py:legacy.old.helper_old", "resolution": "resolved", "confidence": "exact", "origin": "native:python"},
    {"src": "py:pkg.app", "file": "pkg/app.py", "line": 1, "col": 19, "ref_kind": "use", "target_text": "Solver", "dst": "py:pkg.core.Solver", "resolution": "resolved", "confidence": "exact", "origin": "native:python"},
    {"src": "py:pkg.app", "file": "pkg/app.py", "line": 1, "col": 27, "ref_kind": "use", "target_text": "compute", "dst": "py:pkg.core.compute", "resolution": "resolved", "confidence": "exact", "origin": "native:python"},
    {"src": "py:pkg.app", "file": "pkg/app.py", "line": 2, "col": 15, "ref_kind": "use", "target_text": "core", "dst": "py:pkg.core", "resolution": "resolved", "confidence": "exact", "origin": "native:python"},
    {"src": "py:pkg.app", "file": "pkg/app.py", "line": 3, "col": 8, "ref_kind": "use", "target_text": "os.path", "dst": "ext:python:os.path", "resolution": "external", "confidence": "exact", "origin": "native:python"},
    {"src": "py:pkg.app.main", "file": "pkg/app.py", "line": 7, "col": 9, "ref_kind": "call", "target_text": "Solver", "dst": "py:pkg.core.Solver", "resolution": "resolved", "confidence": "exact", "origin": "native:python"},
    {"src": "py:pkg.app.main", "file": "pkg/app.py", "line": 8, "col": 5, "ref_kind": "call", "target_text": "s.run", "dst": "py:pkg.core.Solver.run", "resolution": "resolved", "confidence": "resolved", "origin": "native:python"},
    {"src": "py:pkg.app.main", "file": "pkg/app.py", "line": 9, "col": 5, "ref_kind": "call", "target_text": "core.compute", "dst": "py:pkg.core.compute", "resolution": "resolved", "confidence": "exact", "origin": "native:python"},
    {"src": "py:pkg.app.main", "file": "pkg/app.py", "line": 10, "col": 15, "ref_kind": "call", "target_text": "getattr", "dst": "ext:python:builtins.getattr", "resolution": "external", "confidence": "exact", "origin": "native:python"},
    {"src": "py:pkg.app.main", "file": "pkg/app.py", "line": 11, "col": 5, "ref_kind": "dynamic_call", "target_text": "handler", "dst": "py:pkg.core.compute", "resolution": "resolved", "confidence": "heuristic", "origin": "native:python"},
    {"src": "py:pkg.app.main", "file": "pkg/app.py", "line": 12, "col": 12, "ref_kind": "call", "target_text": "os.path.join", "dst": "ext:python:os.path.join", "resolution": "external", "confidence": "exact", "origin": "native:python"},
    {"src": "py:pkg.app", "file": "pkg/app.py", "line": 16, "col": 5, "ref_kind": "call", "target_text": "main", "dst": "py:pkg.app.main", "resolution": "resolved", "confidence": "exact", "origin": "native:python"},
    {"src": "py:pkg.core", "file": "pkg/core.py", "line": 2, "col": 8, "ref_kind": "use", "target_text": "functools", "dst": "ext:python:functools", "resolution": "external", "confidence": "exact", "origin": "native:python"},
    {"src": "py:pkg.core.tracer", "file": "pkg/core.py", "line": 6, "col": 6, "ref_kind": "call", "target_text": "functools.wraps", "dst": "ext:python:functools.wraps", "resolution": "external", "confidence": "exact", "origin": "native:python"},
    {"src": "py:pkg.core.tracer.wrapper", "file": "pkg/core.py", "line": 8, "col": 16, "ref_kind": "dynamic_call", "target_text": "fn", "dst": null, "resolution": "unresolved", "confidence": "heuristic", "origin": "native:python"},
    {"src": "py:pkg.core.Base.setup", "file": "pkg/core.py", "line": 14, "col": 16, "ref_kind": "call", "target_text": "self.check", "dst": "py:pkg.core.Base.check", "resolution": "resolved", "confidence": "resolved", "origin": "native:python"},
    {"src": "py:pkg.core.Solver", "file": "pkg/core.py", "line": 20, "col": 14, "ref_kind": "inherit", "target_text": "Base", "dst": "py:pkg.core.Base", "resolution": "resolved", "confidence": "exact", "origin": "native:python"},
    {"src": "py:pkg.core.Solver", "file": "pkg/core.py", "line": 21, "col": 6, "ref_kind": "call", "target_text": "tracer", "dst": "py:pkg.core.tracer", "resolution": "resolved", "confidence": "exact", "origin": "native:python"},
    {"src": "py:pkg.core.Solver.run", "file": "pkg/core.py", "line": 23, "col": 9, "ref_kind": "call", "target_text": "self.setup", "dst": "py:pkg.core.Base.setup", "resolution": "resolved", "confidence": "resolved", "origin": "native:python"},
    {"src": "py:pkg.core.Solver.run", "file": "pkg/core.py", "line": 24, "col": 16, "ref_kind": "call", "target_text": "compute", "dst": "py:pkg.core.compute", "resolution": "resolved", "confidence": "exact", "origin": "native:python"}
  ],
  "edges": [
    {"src": "py:legacy.old.old_main", "dst": "py:legacy.old.helper_old", "kind": "calls", "site_count": 1},
    {"src": "py:pkg.app", "dst": "ext:python:os.path", "kind": "uses", "site_count": 1},
    {"src": "py:pkg.app", "dst": "py:pkg.app.main", "kind": "calls", "site_count": 1},
    {"src": "py:pkg.app", "dst": "py:pkg.core", "kind": "uses", "site_count": 1},
    {"src": "py:pkg.app", "dst": "py:pkg.core.Solver", "kind": "uses", "site_count": 1},
    {"src": "py:pkg.app", "dst": "py:pkg.core.compute", "kind": "uses", "site_count": 1},
    {"src": "py:pkg.app.main", "dst": "ext:python:builtins.getattr", "kind": "calls", "site_count": 1},
    {"src": "py:pkg.app.main", "dst": "ext:python:os.path.join", "kind": "calls", "site_count": 1},
    {"src": "py:pkg.app.main", "dst": "py:pkg.core.Solver", "kind": "calls", "site_count": 1},
    {"src": "py:pkg.app.main", "dst": "py:pkg.core.Solver.run", "kind": "calls", "site_count": 1},
    {"src": "py:pkg.app.main", "dst": "py:pkg.core.compute", "kind": "calls", "site_count": 2},
    {"src": "py:pkg.core", "dst": "ext:python:functools", "kind": "uses", "site_count": 1},
    {"src": "py:pkg.core.Base.setup", "dst": "py:pkg.core.Base.check", "kind": "calls", "site_count": 1},
    {"src": "py:pkg.core.Solver", "dst": "py:pkg.core.Base", "kind": "inherits", "site_count": 1},
    {"src": "py:pkg.core.Solver", "dst": "py:pkg.core.tracer", "kind": "calls", "site_count": 1},
    {"src": "py:pkg.core.Solver.run", "dst": "py:pkg.core.Base.setup", "kind": "calls", "site_count": 1},
    {"src": "py:pkg.core.Solver.run", "dst": "py:pkg.core.compute", "kind": "calls", "site_count": 1},
    {"src": "py:pkg.core.tracer", "dst": "ext:python:functools.wraps", "kind": "calls", "site_count": 1}
  ],
  "fallback_files": ["legacy/old.py"]
}
