{
  "description": "Classes, inheritance, virtual call, typed receivers, a macro hiding a call, static function",
  "nodes": [
    {"uid": "cpp:geo::Shape", "kind": "type", "subtype": "cpp_class", "file": "shape.hpp", "line_start": 3, "line_end": 8},
    {"uid": "cpp:geo::Shape::scaled(double)", "kind": "routine", "subtype": "cpp_method", "file": "shape.cpp", "line_start": 7, "line_end": 10},
    {"uid": "cpp:geo::Square", "kind": "type", "subtype": "cpp_class", "file": "shape.hpp", "line_start": 9, "line_end": 15},
    {"uid": "cpp:geo::Square::Square(double)", "kind": "routine", "subtype": "cpp_method", "file": "shape.hpp", "line_start": 11, "line_end": 11},
    {"uid": "cpp:geo::Square::area()", "kind": "routine", "subtype": "cpp_method", "file": "shape.hpp", "line_start": 12, "line_end": 12},
    {"uid": "cpp:log_call(const char*)@shape.cpp", "kind": "routine", "subtype": "cpp_function", "file": "shape.cpp", "line_start": 4, "line_end": 4},
    {"uid": "cpp:total(const geo::Square&)", "kind": "routine", "subtype": "cpp_function", "file": "shape.cpp", "line_start": 13, "line_end": 15}
  ],
  "call_sites": [
    {"src": "cpp:geo::Square", "file": "shape.hpp", "line": 9, "col": 23, "ref_kind": "inherit", "target_text": "Shape", "dst": "cpp:geo::Shape", "resolution": "resolved", "confidence": "exact", "origin": "native:cpp"},
    {"src": "file:shape.cpp", "file": "shape.cpp", "line": 1, "col": 11, "ref_kind": "include", "target_text": "shape.hpp", "dst": "file:shape.hpp", "resolution": "resolved", "confidence": "exact", "origin": "native:cpp"},
    {"src": "cpp:geo::Shape::scaled(double)", "file": "shape.cpp", "line": 8, "col": 5, "ref_kind": "call", "target_text": "log_call", "dst": "cpp:log_call(const char*)@shape.cpp", "resolution": "resolved", "confidence": "resolved", "origin": "native:cpp"},
    {"src": "cpp:geo::Shape::scaled(double)", "file": "shape.cpp", "line": 9, "col": 16, "ref_kind": "call", "target_text": "area", "dst": "cpp:geo::Square::area()", "resolution": "resolved", "confidence": "resolved", "origin": "native:cpp"},
    {"src": "cpp:total(const geo::Square&)", "file": "shape.cpp", "line": 14, "col": 12, "ref_kind": "call", "target_text": "sq.scaled", "dst": "cpp:geo::Shape::scaled(double)", "resolution": "resolved", "confidence": "resolved", "origin": "native:cpp"},
    {"src": "cpp:total(const geo::Square&)", "file": "shape.cpp", "line": 14, "col": 29, "ref_kind": "call", "target_text": "sq.area", "dst": "cpp:geo::Square::area()", "resolution": "resolved", "confidence": "resolved", "origin": "native:cpp"}
  ],
  "edges": [
    {"src": "cpp:geo::Shape::scaled(double)", "dst": "cpp:geo::Square::area()", "kind": "calls", "site_count": 1},
    {"src": "cpp:geo::Shape::scaled(double)", "dst": "cpp:log_call(const char*)@shape.cpp", "kind": "calls", "site_count": 1},
    {"src": "cpp:geo::Square", "dst": "cpp:geo::Shape", "kind": "inherits", "site_count": 1},
    {"src": "cpp:total(const geo::Square&)", "dst": "cpp:geo::Shape::scaled(double)", "kind": "calls", "site_count": 1},
    {"src": "cpp:total(const geo::Square&)", "dst": "cpp:geo::Square::area()", "kind": "calls", "site_count": 1},
    {"src": "file:shape.cpp", "dst": "file:shape.hpp", "kind": "uses", "site_count": 1}
  ]
}
